{
  "contract_version": "interaction-event/v1",
  "interaction_id": "interaction:001",
  "event_id": "interaction:001:outcome:001",
  "event_type": "experience-outcome",
  "occurred_at": "2026-08-11T20:35:00+09:00",
  "session_ref": "session:001",
  "agent": {
    "agent_id": "interaction-agent",
    "version": "1.1.0"
  },
  "intent": {
    "category": "create",
    "goal_ref": "goal:portfolio-concept",
    "requested_capabilities": ["knowledge-retrieval", "artifact-creation"]
  },
  "source_snapshots": [
    {
      "repository": "self-model",
      "commit": "1f92e629589c945c840c025a2d08e6aa95e7bfa5"
    },
    {
      "repository": "art-history",
      "commit": "372928427b3dcdb1921e7c2c9fe5ff2e305d51e9"
    }
  ],
  "signal_refs": ["signal:self:001", "signal:art:001"],
  "outcome": {
    "status": "completed-with-gaps",
    "artifact_refs": ["artifact:interaction-001:001"],
    "unresolved_codes": ["marketing-freshness-review"]
  },
  "explicit_feedback_refs": [],
  "privacy": {
    "consent_scope": "user-requested-output",
    "retention": "external-artifact",
    "raw_conversation_stored": false,
    "direct_identifiers_stored": false
  }
}
